株式会社GWF,新しいことに取り組めるWebエンジニア 女性活躍中,大阪市 新大阪駅 徒歩7分,月給23万円～26万円,1日前,リクナビNEXT
リバティ・フィッシュ株式会社,Ruby on Rails システムエンジニア・Webエンジ...,大阪府,"月給21万6,000円～35万円",4日前,PROSEEK
株式会社デジアサ,WEB エンジニア,大阪市 福島駅,"月給20万9,500円",10時間前,株式会社デジアサ
株式会社だんきち,Webエンジニア、アプリエンジニア,大阪府 摂津市,月給25万円～,10時間前,株式会社だんきち
OPEN STORE株式会社,マーケティング会社のWEBエンジニア,大阪市 西中島南方駅 徒歩7分,月給23万円～40万円,8時間前,OPEN STORE株式会社
WDB株式会社,WEBエンジニア,姫路市 姫路駅 徒歩5分,月給26万円～33万円,10時間前,WDB株式会社
セカイエ株式会社,Webエンジニア～完全内製の自社サービスサイト～,大阪市 大阪駅,年収350万円～700万円,6日前,doda
株式会社スタッフサービス,業務・WEB系システムエンジニア要件定義,大阪市 西中島南方駅 徒歩3分,"月給21万5,000円～30万円",2日前,スタッフサービス・エンジニアリング 常用型派遣
ノックス株式会社,4月入社急募 WEBエンジニア／大阪福島 自社内開発／前年度...,大阪市 福島区,年収500万円～700万円,4日前,リクルートエージェント
株式会社ニューロテックシステム,WEBエンジニア・基幹系エンジニア,大阪市 本町駅 徒歩2分,月給21万円～40万円,10時間前,株式会社ニューロテックシステム
システムクリエイト株式会社,業務系アプリケーションエンジニア,長岡京市 長岡京駅 徒歩11分,年収300万円～600万円,8時間前,システムクリエイト株式会社
株式会社エイチーム,Web開発エンジニア,大阪市 梅田駅 徒歩3分,月給30万円～,3日前,CREATIVE JOB
ZENoffice株式会社,Webエンジニア,大阪市 中央区,年収300万円～450万円,5日前,doda
株式会社トリニティーキャリアマネジメント,業務系システム開発エンジニア,大阪市 中央区,月給16万円～60万円,12時間前,株式会社トリニティーキャリアマネジメント
エイビースタッフ株式会社,WEBアプリケーションエンジニア,兵庫県 明石市,月給21万円～44万円,8時間前,エイビースタッフ株式会社
株式会社Qript,Webエンジニア,大阪市 心斎橋駅 徒歩5分,年収300万円～600万円,10時間前,株式会社Qript
株式会社プログデンス,Web開発エンジニア／柔軟性の高い自社製品の開発・導入から提...,大阪府 大阪市,年収350万円～550万円,5日前,マイナビ転職エージェントサーチ
株式会社ラクス,Web開発エンジニア,大阪市 北区,"月給34万1,094円～48万6,781円",1日前,DOMO!NET
Sansan株式会社,Webアプリエンジニア,大阪市 北区,"年収553万円～1,204万円",3日前,パソナキャリア
シビレ株式会社,大阪に新拠点も。創造的な活動にフォーカスできる社会へ!Web...,大阪市 大阪駅 徒歩5分,月給30万円～,10時間前,シビレ株式会社
株式会社FREEMIND,Web系エンジニア,京都市 中京区,年収400万円～500万円,2日前,doda
ジャパニアス株式会社,業務系システムエンジニア～希望勤務地配属 転勤なし 自社内開...,大阪府,年収451万円～800万円,6日前,doda
富士ソフト株式会社,業務系ソフトウェアエンジニア,大阪市 堺筋本町駅,年収400万円～800万円,5日前,doda
株式会社トレンドアート,業務系システムエンジニア,大阪市 肥後橋駅,年収350万円～600万円,6日前,doda
クローバーラボ株式会社,Webエンジニア アプリケーションエンジニア,大阪市 中津駅 徒歩2分,年収280万円,1日前,IMAGICA DIGITALSCAPE
アイテック阪急阪神株式会社,Webシステムエンジニア,大阪市 野田阪神駅,年収450万円～650万円,5日前,doda
株式会社カプコン,Web開発エンジニア,大阪市 北浜駅 徒歩7分,年収350万円～750万円,4時間前,CREATIVE JOB
株式会社AIVICK,Webアプリケーションエンジニア,京都市 京都駅 徒歩9分,月給25万円～55万円,9時間前,株式会社AIVICK
楽天株式会社,Webアプリケーションエンジニア ミドルクラス 大阪勤務:C...,大阪市 渡辺橋駅 徒歩1分,公開していません,1日前,CREATIVE JOB
株式会社クラウドシード,Webデザイナー兼フロントエンジニア募集! 年間休日120日...,大阪市 北新地駅 徒歩5分,月給20万円～24万円,4日前,Find Job!
株式会社金剛情報システム,Web・オープン系エンジニア,大阪市 中央区,月給20万円～60万円,9時間前,株式会社金剛情報システム
日本ウェブサービス株式会社,システムエンジニア／Web・インフラ・組込系／年休128日／...,大阪市 大阪駅,年収400万円～800万円,5日前,マイナビ転職エージェントサーチ
トランスコスモス株式会社~東証一部上場～,自社内勤務のWebシステム開発エンジニア ～東証一部上場・育...,大阪市 肥後橋駅,年収350万円～500万円,6日前,doda
エックスサーバー株式会社,Webエンジニア アプリケーションエンジニア,大阪市 大阪駅 徒歩3分,年収300万円,1日前,IMAGICA DIGITALSCAPE
株式会社エースラボ,Webコーダー・フロントエンドエンジニア,大阪市 天神橋筋六丁目駅 徒歩3分,月給22万円～,10時間前,株式会社エースラボ
株式会社イースマイル,WEBアプリケーションエンジニア,京都府 宮津市,月給21万円～44万円,19時間前,株式会社イースマイル
株式会社アーシャルデザイン,全国のアスリートを応援! WEBエンジニア／サポート事務,大阪府 大阪市,月給22万円～,5日前,リクナビNEXT
株式会社ステークホルダーコム,Webエンジニア アプリケーションエンジニア,大阪市 本町駅 徒歩3分,年収300万円,1日前,IMAGICA DIGITALSCAPE
株式会社JO2,WEBオープン系エンジニア 給与額希望考慮,大阪市 港区,月給30万円～70万円,8時間前,株式会社JO2
マンパワーグループ株式会社,Webフロントエンド開発エンジニア,大阪市 淀屋橋駅,"年収450万円～1,000万円",7日前,doda
株式会社Just.Assist,業務系システム開発エンジニア C#,大阪市 大阪駅,月給22万円～40万円,2時間前,株式会社Just.Assist
株式会社スタジオキャンビー,PHP+Laravel or HTML5+Vue.JS We...,大阪市 玉川駅 徒歩3分,"月給25万9,765円～",1日前,かんたん応募
日本アシスト株式会社,WEB系エンジニア,大阪市 西梅田駅 徒歩3分,"月給23万5,000円～40万円",1日前,ハローワーク梅田
株式会社EDIBAM,SE WEBエンジニア／インターネット／Webサービス 等,大阪市 大阪駅,月給25万円～50万円,3時間前,株式会社EDIBAM
株式会社銀河総合研究所,未経験歓迎!ネットワーク・Webエンジニア,大阪府 大阪市,月給18万円～,1日前,リクナビNEXT
株式会社トライコムワークス,WEBアプリケーションエンジニア,大阪府 大阪市,年収350万円～800万円,2時間前,株式会社トライコムワークス
株式会社上武,WEB系プログラマー、システムエンジニア,大阪市 天満橋駅 徒歩3分,月給24万円～30万円,1日前,ハローワーク大阪東
株式会社ブリッジコーポレーション,Webエンジニア・PG,京都市 中京区,月給24万円～,2時間前,株式会社ブリッジコーポレーション
株式会社ダトラ,Webエンジニア,大阪市 堺筋本町駅,月給35万円～,21時間前,株式会社ダトラ
株式会社曙題工業,WEBアプリケーションエンジニア,大阪市 大阪駅 徒歩1分,月給21万円～44万円,10時間前,Workin.jp
株式会社リューズ,インフラエンジニア WEB面接可,大阪府,年収300万円～500万円,10時間前,リクルートエージェント
株式会社KIDA,WEBアプリエンジニア,大阪市 福島区,月給25万円～,7時間前,株式会社KIDA
株式会社コネクト通信,WEB・オープン系エンジニア／Java 年休125日・土日休,大阪府 大阪市,月給21万円～38万円,1日前,リクナビNEXT
サービス&セキュリティ株式会社,業務系開発エンジニア,大阪市 淀屋橋駅 徒歩5分,年収480万円～840万円,2日前,ハローワーク梅田
株式会社アウトソーシングテクノロジー,時代に合った働き方と技術を選択!組込み・WEB系エンジニア,大阪府 大阪市,月給25万円～60万円,4日前,リクナビNEXT
株式会社ボイス,Webエンジニア,大阪府 大阪市,年収400万円～900万円,1日前,type
シルバーエッグ・テクノロジー株式会社,自社開発Webエンジニア,大阪府,公開していません,22時間前,Daijob.com
株式会社新日本ニーズ,オープン・WEB系システムエンジニア,大阪市 肥後橋駅,月給23万円～,8時間前,株式会社新日本ニーズ
マイクロ波化学株式会社,WEB面接可 メカニカルエンジニア 大手企業取り引き多数,大阪市 住之江区,"年収700万円～1,200万円",2日前,リクルートエージェント
株式会社SOBAプロジェクト,WEBアプリケーションエンジニア,大阪府,月給40万円～50万円,4日前,マイナビ転職
楽天グループ株式会社,Webアプリケーションエンジニア 大阪勤務00013431,大阪市 北区,年収450万円～900万円,2日前,リクルートエージェント
株式会社日本ビジネスデータープロセシングセンター,社内情報システム室のWEBエンジニア,神戸市 三宮駅 徒歩10分,"月給20万5,000円～",3日前,株式会社日本ビジネスデータープロセシングセンター
日本電気硝子株式会社,プラント電気設備エンジニア web完結,京都市 京都駅 徒歩13分,年収600万円～800万円,3日前,パソナキャリア
株式会社新大陸,Webエンジニア・グロースハッカー,大阪市 西区,年収350万円～600万円,2日前,リクルートエージェント
株式会社エス・アイ・エス,既卒歓迎 Web系エンジニア,大阪市 JR難波駅,年収300万円～650万円,4日前,Re就活
株式会社ジャム・デザイン,Webディレクター、WEBデザイナー、Webエンジニア／移住...,神戸市 三宮駅 徒歩10分,月給20万円～40万円,2日前,ひょうごで働こう！マッチングサイト
キャル株式会社,Web系開発エンジニア,大阪市 心斎橋駅 徒歩1分,月給25万円～50万円,3日前,ハローワーク大阪西
コンピューターシステム株式会社,WEB系システム開発エンジニア,大阪市 大阪駅,月給28万円～55万円,4日前,ハローワーク梅田
株式会社KYOSO,WEBエンジニア 創業以来無借金経営／プライム多数,大阪府,年収353万円～680万円,2日前,リクルートエージェント
株式会社アビリブ,Web予約システム開発エンジニア／SE,大阪市 北区,月給35万円～60万円,3日前,転職ナビ
FlamingJune合同会社,Webエンジニア デザイナー,京都市 烏丸駅 徒歩5分,月給20万円～30万円,6日前,FlamingJune合同会社
株式会社エンファシス,業務系システムエンジニア!大手案件多数／テレワーク／残業20...,大阪府,年収331万円～450万円,4日前,リクルートエージェント
株式会社GSI,サーバーサイドエンジニア／Webエンジニア 上流～下流まで／...,大阪市 本町駅,年収300万円～500万円,4日前,レバテックキャリア
株式会社メガチップス,Webエンジニア,大阪市 淀川区,年収700万円～900万円,3日前,パソナキャリア
株式会社サンウェル,業務系システム開発エンジニア,大阪市 西区,月給22万円～35万円,5日前,type
トゥモローゲート株式会社,Webデザイナー／マークアップエンジニア兼務,大阪市 心斎橋駅 徒歩3分,年収300万円～,7日前,転職ナビ
株式会社ドリームジャック,WEB系開発エンジニア,大阪市 西中島南方駅 徒歩5分,月給30万円～50万円,6日前,エン転職
株式会社with,業務系アプリケーションエンジニア・プログラマ10701,大阪市 堺筋本町駅 徒歩2分,年収350万円～750万円,9時間前,株式会社with
株式会社ネットオン,自社サービス開発Webシステムエンジニア,大阪市 梅田駅,月給21万円～,10時間前,株式会社ネットオン
ナッシュ株式会社,自社ECサイトのWEBエンジニア,大阪市 淀屋橋駅 徒歩5分,月給25万円～,9時間前,ナッシュ株式会社
株式会社フロンティア本社,サーバーエンジニア WEB面接,大阪府 大阪市,月給20万円～45万円,9時間前,株式会社フロンティア本社
株式会社ティルトローター,マークアップエンジニア・ WEBプログラマ,大阪市 大国町駅 徒歩5分,月給28万円～,9時間前,株式会社ティルトローター
株式会社アイブレイズ,Webオープン系エンジニア,大阪市 淀川区,月給20万円～,10時間前,株式会社アイブレイズ
アイオステクノロジー株式会社,Webエンジニア オンライン面接実施中,大阪市 難波駅,月給20万円～22万円,9時間前,アイオステクノロジー株式会社
Bone株式会社 大阪 北堀江,WEBデザイナー・マークアップエンジニア,大阪市 四ツ橋駅 徒歩2分,月給25万円～50万円,9時間前,Bone株式会社
株式会社GSC,WEB系・オープン系エンジニア,大阪市 新大阪駅 徒歩6分,月給18万円～38万円,10時間前,株式会社GSC
株式会社キャピタル・アセット・プランニング,Webアプリケーション開発のエンジニア,大阪市 西梅田駅 徒歩5分,年収400万円～,10時間前,株式会社キャピタル・アセット・プランニング
アンクラージェ株式会社,Web・オープン系エンジニア 未経験,大阪市 本町駅 徒歩4分,月給20万円～28万円,9時間前,アンクラージェ株式会社
株式会社グラント,オープン・WEB系エンジニア,大阪市 大阪天満宮駅,月給26万円～40万円,10時間前,株式会社グラント
株式会社カインド,グラフィックデザイナー／WEBデザイナー／システムエンジニア,大阪市 JR難波駅 徒歩1分,月給25万円～35万円,10時間前,株式会社カインド
株式会社京繊,Webデザイナー、UIエンジニア,京都市 烏丸駅,"月給21万4,000円～35万円",9時間前,株式会社京繊
株式会社グローバー,受託開発／SE・PG／業務系アプリエンジニア,大阪市 肥後橋駅 徒歩5分,"月給25万円～45万8,333円",9時間前,株式会社グローバー
ヴァイタル・インフォメーション株式会社,WEB／オープン系 エンジニア,大阪市 本町駅 徒歩3分,"月給20万5,000円～40万円",10時間前,ヴァイタル・インフォメーション株式会社大阪本部
株式会社Nascom,Webシステム設計開発エンジニア,大阪市 谷町四丁目駅 徒歩3分,月給25万円～35万円,9時間前,株式会社Nascom
株式会社プロフィットバンク,Webアプリケーションエンジニア,大阪市 新大阪駅 徒歩5分,月給25万円～45万円,9時間前,株式会社プロフィットバンク
株式会社トラストシステムソリューションズ,業務系ITエンジニア、U・Iターン、第二新卒歓迎,大阪市 本町駅 徒歩3分,月給20万円～45万円,9時間前,株式会社トラストシステムソリューションズ
総合経営サポートセンター,WEBアプリケーションエンジニア,京都府 京田辺市,月給21万円～44万円,9時間前,総合経営サポートセンター
株式会社ピイアイシイ,Webシステム開発エンジニア,大阪市 本町駅 徒歩4分,"月給20万円～55万1,000円",9時間前,株式会社ピイアイシイ
シアトルコンサルティング株式会社,Webエンジニア 第二新卒歓迎,大阪市 なんば駅 徒歩1分,"月給25万円～57万1,400円",9時間前,シアトルコンサルティング株式会社
株式会社BLUE,IT、WEBエンジニア,大阪市 肥後橋駅 徒歩5分,月給18万円～,10時間前,株式会社BLUE
株式会社アイエスサービス,Webシステムエンジニア,大阪市 北浜駅 徒歩6分,月給25万円～45万円,10時間前,株式会社アイエスサービス
プロシスタ株式会社,Webデザイナー・UIエンジニア,大阪市 新大阪駅 徒歩8分,"月給19万775円～43万5,900円",10時間前,プロシスタ株式会社
株式会社FAN・DREAM 大阪オフィス,クオリティエンジニア／業務系システム／PL・PM Va,大阪市 本町駅 徒歩5分,月給33万円～83万円,9時間前,株式会社FAN・DREAM
株式会社Her's,業務系アプリケーションエンジニア プログラマ,大阪市 西区,月給35万円～40万円,9時間前,株式会社Her's
株式会社超克 大阪、北浜,Webデザイナー、UIエンジニア,大阪市 北区,年収300万円～800万円,9時間前,株式会社超克
アートノイズ,Webデザイナー、UIエンジニア,神戸市 三宮駅,月給30万円～50万円,9時間前,アートノイズ
株式会社伸和トータルエンジニアリング,WEB系システムエンジニア,大阪市 堺筋本町駅 徒歩6分,月給20万円～,9時間前,株式会社伸和トータルエンジニアリング
株式会社アイティープランニング,WEBエンジニア,大阪市 肥後橋駅 徒歩1分,月給20万円～,10時間前,株式会社アイティープランニング
株式会社インサイト,web系開発エンジニア,豊中市 千里中央駅 徒歩5分,月給20万円～,10時間前,株式会社インサイト
株式会社ブイ・クルーズ,Webエンジニア／プログラマ,京都市 烏丸御池駅 徒歩5分,月給20万円～50万円,9時間前,株式会社ブイ・クルーズ
中央情報システム株式会社,Web・オープン系システムエンジニア、プログラマ,大阪市 天満橋駅 徒歩7分,月給20万円～45万円,9時間前,中央情報システム株式会社大阪中央事業所
合同会社テックコネクト,Webデザイナー、UIエンジニア,大阪市 大阪駅,"月給21万4,200円～35万7,000円",10時間前,合同会社テックコネクト
マカレル株式会社,システムエンジニア,大阪市 肥後橋駅,月給30万円～,16時間前,エン転職
トランス･コスモス株式会社,ソーシャルメディア・モバイル向けアプリケーション開発エンジニ...,大阪市 大阪駅,公開していません,7日前,CREATIVE JOB
