まりもテクノロジー株式会社,WEBエンジニア,札幌市 札幌駅 徒歩2分,年収300万円～500万円,1日前,U29JOB
株式会社ノア,WEBエンジニア,札幌市 大通駅 徒歩5分,月給18万円～25万円,5日前,ハローワーク札幌
株式会社エイチ・エル・シー,Web面接可 人事・エンジニアの研修講師,札幌市 中央区,年収320万円～430万円,4日前,パソナキャリア
Break's株式会社,webエンジニア,札幌市 中央区,年収480万円～750万円,6日前,ジョブキタ
株式会社Point,なりたい自分になるために会社を使ったっていい SE／PG,札幌市 バスセンター前駅,"月給24万円～37万5,000円",5日前,マイナビ転職
外資系大手生命保険会社,外資系生保 システムリスク管理部門,北海道,"年収950万円～1,300万円",5日前,日経転職版
株式会社クリーク・アンド・リバー社,Webコーダーの方必見!あなたのご希望に沿えるお仕事をご紹介...,札幌市 札幌駅 徒歩5分,年収260万円～500万円,1日前,CREATIVE JOB
NECソリューションイノベータ株式会社,デジタルガバメント関連システム開発を行うシステムエンジニア／...,札幌市 北区,公開していません,3日前,マイナビAGENT
「東証一部上場グループ」業界売上シェア第1位の技...,開発エンジニア・SE／PL／PM ワークライフバランス重視 ...,北海道,月給23万円～50万円,6日前,日経転職版
株式会社ホープス,ERPの設計・開発や、Java、C#.netなどのスクラッチ...,札幌市 中央区,月給25万円～,5時間前,日経転職版
クラスメソッド株式会社,バックエンドアプリケーション開発担当,北海道,年収450万円～800万円,4日前,マイナビAGENT
スターコンサルティング株式会社／誰が参画してもハ...,SAP S／4 コンサルタント,北海道,年収520万円～920万円,1日前,日経転職版
株式会社SHIFT,品質保証エンジニア,札幌市 大通駅 徒歩5分,"月給33万円～49万5,000円",6日前,type
北明システム株式会社,エンジニア職／転勤なし／残業20時間以内／自社開発,札幌市 西11丁目駅,年収300万円～450万円,1時間前,doda
株式会社GSI,経験が浅い方歓迎 ITエンジニア 最高の環境でリスタートを,札幌市 北区,月給25万円～,5日前,マイナビ転職
株式会社アットマークテクノ,自社開発と受託開発のいいとこどりをした環境で開発できます,札幌市 北12条駅,年収350万円～550万円,1日前,doda
アートシステム株式会社,ITエンジニア,札幌市 南郷18丁目駅,年収320万円～500万円,1時間前,doda
自動車アフターマーケットのリーディングカンパニー,クラウド開発エンジニア,札幌市 北区,年収380万円～600万円,5日前,日経転職版
アークレイインフィニティ株式会社,フィールドエンジニア 国内シェアトップクラスの医療検査システ...,札幌市 中央区,年収400万円～600万円,23時間前,doda
ジーエムラボ株式会社,PG／SE／WEBデザイナー 経験者優遇!環境問題を自社技術...,札幌市 新さっぽろ駅 バス10分,月給17万円～60万円,5日前,マイナビ転職
株式会社ジユー・ロータス,組込系エンジニア,札幌市 札幌駅,年収300万円～600万円,1時間前,doda
弊社グループ会社でもある石油業界国内トップの石油...,複数募集／業界トップの石油精製・元売会社での回転機械の計画・...,北海道,"年収600万円～1,200万円",6時間前,日経転職版
ブレイヴコンピュータ株式会社,第二創業期、コアメンバー募集 サーバ・フィールドエンジニア,札幌市 北12条駅 徒歩6分,月給38万円～52万円,2日前,リクナビNEXT
株式会社高田工業所,プラントエンジニアリング系技術職,北海道 苫小牧市,月給20万円～50万円,2日前,マイナビ転職
株式会社ジェイマックシステム,アプリ開発エンジニア,札幌市 さっぽろ駅 徒歩8分,年収354万円～700万円,7時間前,U29JOB
J-POWERテレコミュニケーションサービス株式...,電気・通信設備の技術者 通信エンジニア／施工管理エンジニア,北海道 札幌市,"月給19万9,800円～30万4,800円",3日前,リクナビNEXT
株式会社エス・イー・シー・ハイテック,既卒歓迎・ネットワークエンジニア,北海道,年収350万円～700万円,11時間前,Re就活
株式会社ProVision,システムエンジニア,札幌市 さっぽろ駅,年収300万円～730万円,1時間前,doda
株式会社OMJ,業務用アプリケーション保守運用業務,札幌市 西11丁目駅 徒歩3分,"月給24万9,000円～44万1,000円",2日前,ハローワーク札幌
北海道旅客鉄道株式会社,保線・土木・建築,北海道,"月給19万2,340円～",2日前,マイナビ転職
株式会社前澤エンジニアリングサービス,年休123日／平均有給取得日数14日,札幌市 中央区,年収300万円～500万円,14時間前,リクルートエージェント
株式会社ミックウェア,大手自動車メーカー直取引!最上流工程で活躍!／ITエンジニア,札幌市 さっぽろ駅 徒歩2分,月給35万円～45万円,2日前,リクナビNEXT
株式会社アルファクス・フード・システム,上場企業で活躍! 総合職,札幌市 札幌駅 徒歩1分,月給21万円～35万円,3日前,マイナビ転職
ソリッドシード株式会社,開発エンジニア 全社員年収UP!? 社員81%がリモート勤務,北海道,月給25万円～,2日前,マイナビ転職
株式会社関電工,業界トップクラス電気設備管理 全国各拠点,北海道,年収400万円～750万円,1日前,マイナビ転職エージェントサーチ
株式会社ジュピターテレコム,既卒歓迎 システムエンジニア,北海道,年収350万円～400万円,11時間前,Re就活
株式会社コネクト,システムエンジニア,札幌市 札幌駅 徒歩15分,年収300万円～450万円,9時間前,U29JOB
日本テクニカルシステム株式会社,派遣業向webシステム開発,札幌市 大通駅 徒歩5分,月給27万円～45万円,3日前,ハローワーク札幌
株式会社エニシアス,インフラエンジニア,札幌市 札幌駅,年収401万円～700万円,1時間前,doda
有限会社アークネット,システムエンジニア・プログラマー,札幌市 中央区,月給18万円～32万円,2日前,ハローワーク札幌
株式会社インタラクティブ・コミュニケーション・デ...,システムエンジニア・プログラマー・テスター,札幌市 大通駅 徒歩1分,"月給18万4,000円～35万円",2日前,ハローワーク札幌
アビトップ株式会社,プラスチック商社の提案営業 UI積極採用・20代30代活躍中,北海道 苫小牧市,月給20万円～25万円,3日前,リクナビNEXT
ACJ株式会社,未経験からスタート! ITエンジニア 前給保証 年休125日,札幌市 西11丁目駅 徒歩4分,月給30万円～,2日前,マイナビ転職
株式会社バリューソフトウエア,システムエンジニア／プログラマー,札幌市 西8丁目駅 徒歩2分,"月給23万9,200円～31万2,800円",2日前,Create 転職
株式会社ホクハイサービス,エンジニア、研究開発・新製品開発・設計,札幌市 札幌駅,"月給21万5,000円～",20時間前,株式会社ホクハイサービス 本社
株式会社ノースマート,北海道のベンチャーで働く SE 100%自社開発,北海道 石狩市,月給30万円～50万円,3日前,リクナビNEXT
株式会社ブレーンナレッジシステムズ,上級SE,札幌市 中央区,年収400万円～600万円,23時間前,パソナキャリア
株式会社アベールジャパン,学歴・年齢不問 選べるキャリア ITエンジニア 年休126日,札幌市 中央区,月給25万円～50万円,3日前,リクナビNEXT
株式会社北海道キューブシステム,ITエンジニア U・Iターン入社実績多数 Web面接可能,札幌市 大通駅,"月給20万円～35万5,000円",5日前,マイナビ転職
岩田地崎建設株式会社,UIターン歓迎!北海道を代表する企業の社内SE20～30代活...,札幌市 中央区,月給22万円～40万円,5日前,マイナビ転職
株式会社スニットコンピュータ,システムエンジニア,札幌市 中の島駅 徒歩7分,年収300万円～450万円,1日前,U29JOB
キャル 株式会社 札幌オフィス,PLC制御設計技術者,札幌市 大通駅 徒歩5分,月給25万円～40万円,2日前,ハローワーク札幌
株式会社トライアンフ,未経験OK サービスエンジニア 風通し 理想の働き方ができる,札幌市 白石区,"月給21万5,000円",2日前,マイナビ転職
株式会社YAZ,前給以上保証 リモート勤務 有給消化率75.9% ITエンジ...,札幌市 大通駅 徒歩3分,月給28万円～,5日前,マイナビ転職
株式会社アイエスエフネット,ワークライフバランス大賞／WEB面接可,札幌市 中央区,年収400万円～650万円,14時間前,リクルートエージェント
株式会社アシスト北海道,テクニカルサポートエンジニア 札幌で長期的に安定して就業,札幌市 札幌駅 徒歩4分,"月給20万2,360円～",5日前,マイナビ転職
日本ウォーターシステム株式会社,医療に貢献する 保守・メンテナンススタッフ 未経験歓迎,札幌市 厚別区,月給19万円～30万円,3日前,マイナビ転職
株式会社クレスコ,PM／PL候補,札幌市 さっぽろ駅,年収400万円～650万円,59分前,doda
大成エンジニアリング株式会社,発注者支援業務,北海道,年収540万円～840万円,6時間前,U29JOB
株式会社MAYA STAFFING,システムエンジニア,札幌市 北区,月給25万円～40万円,20時間前,株式会社MAYA STAFFING
ヤスダファインテ株式会社,法人営業／食品プラント設備 WEB面接可,北海道 河西郡,年収330万円～440万円,1日前,リクルートエージェント
株式会社NTTデータ北海道,システムエンジニア,札幌市 北区,年収450万円～600万円,1日前,リクルートエージェント
株式会社ピーアール・デイリー,企画営業 未経験OK,札幌市 西11丁目駅 徒歩5分,月給25万円～,5日前,マイナビ転職
株式会社大塚商会,法人営業,札幌市 中央区,年収400万円～700万円,2日前,パソナキャリア
NTTデータカスタマサービス株式会社,有給取得率100%!得意分野を発揮できる インフラエンジニア,札幌市 中央区,月給20万円～45万円,5日前,マイナビ転職
株式会社セラク,ITエンジニア 未経験入社80% 土日祝休み 年休120日以上,札幌市 中央区,月給22万円～40万円,5日前,マイナビ転職
エヌ・ティ・ティ・システム開発株式会社,システムエンジニア／札幌支店,札幌市 札幌駅 徒歩10分,"月給19万1,500円～38万6,000円",5日前,ハローワーク池袋
株式会社アイラス,5G普及へ貢献／通信工事士・エンジニア,札幌市 苗穂駅 徒歩13分,月給22万円～40万円,2日前,リクナビNEXT
古野電気株式会社,フィールドエンジニア,札幌市 豊水すすきの駅 徒歩5分,"月給20万7,500円～35万円",2日前,U29JOB
東洋株式会社,客先常駐無し インフラエンジニア 若手活躍中,帯広市 帯広駅 車5分,月給19万円～50万円,5日前,マイナビ転職
KCCSキャリアテック株式会社,移動体通信エンジニア～京セラグループ×KDDIグループ出資企...,北海道,年収250万円～550万円,1日前,doda
株式会社メディカルシステムネットワーク,残業月約15時間／WEB面接可能,札幌市 中央区,年収350万円～500万円,1日前,リクルートエージェント
株式会社カワサキマシンシステムズ,サービスエンジニア,札幌市 菊水駅 徒歩10分,年収350万円～550万円,6時間前,U29JOB
株式会社ファインドメーカー,自社内開発 自社システムを顧客毎にカスタマイズ／SE・PG,札幌市 西11丁目駅,月給28万円～60万円,5日前,リクナビNEXT
