株式会社アットマークテクノ,Webアプリ開発エンジニア,札幌市 北12条駅 徒歩1分,"年収326万4,000円～517万8,000円",7時間前,転職ナビ
株式会社ノースディテール,バックエンドエンジニア,札幌市 大通駅 徒歩2分,"月給17万5,000円～60万円",14時間前,株式会社ノースディテール
株式会社メガ・テクノロジー,未経験でも月給26万円～可能 ITエンジニア 資格取得支援あり,札幌市 中央区,月給26万円～,2時間前,マイナビ転職
株式会社ビーエステクニカ,経験が浅くてもOK 自分らしく無理なく働ける SE・PG,札幌市 中央区,月給27万円～55万円,2時間前,マイナビ転職
フィット産業株式会社,システムエンジニア,札幌市 大通駅 徒歩5分,月給27万円～45万円,6時間前,ハローワーク札幌
有限会社光豊,食品関連機械のプログラマー,北海道 石狩市,月給25万円～,12時間前,ジョブキタ
株式会社前田テクノエンジニアリング,配管工,北海道 札幌市,"日給1万円～1万5,000円",8時間前,アルキタ
株式会社アイ・ティー・コネクト,システムエンジニア・プログラマ,札幌市 大通駅 徒歩3分,"月給18万4,000円～24万6,000円",6時間前,ハローワーク札幌
ベスタス・ジャパン株式会社,風力発電機の保守・整備・トラブル対応 メンテナンスエンジニア,北海道,年収400万円～550万円,10時間前,リクナビNEXT
株式会社エス・イー・シー・ハイテック,制御系ソフトウェア開発エンジニア,北海道,年収350万円～700万円,14時間前,Re就活
株式会社ヒューマンウェイブ,機械・電気エンジニア／ビルメンテナンス、半導体エンジニア、製...,北海道,月給21万円～40万円,12時間前,株式会社ヒューマンウェイブ
トライアロー株式会社,セキュリティ未経験から高度な技術に携わる!インフラエンジニア...,札幌市 札幌駅,月給30万円～42万円,59分前,トライアロー株式会社
株式会社ネクストビート,プリンシパルエンジニア,札幌市 中央区,"年収800万円～1,500万円",11時間前,株式会社ネクストビート
株式会社電縁,開発エンジニア,札幌市 バスセンター前駅,"月給25万1,000円～48万8,000円",12時間前,type
株式会社スキーム,SE・PG・WEBアプリケーションエンジニア,札幌市 中央区,月給20万円～35万円,7時間前,転職ナビ
日本ニューホランド株式会社,ボイラー技士／日祝&土隔休／業績堅調大手,北海道 別海町,年収300万円～450万円,13時間前,TechBell
ドクターキューブ株式会社,インストラクター,北海道,月給21万円～50万円,14時間前,ドクターキューブ株式会社
株式会社トゥインクル,システム運用エンジニア 即日入社可能!年間休日120日!残業...,北海道,月給20万円～55万円,14時間前,株式会社トゥインクル
株式会社スキルマーク,システムエンジニア・プログラマー,札幌市 札幌駅,月給33万円～50万円,14時間前,株式会社スキルマーク
ムトーアイテックス株式会社,アプリケーションエンジニア,北海道,月給21万円～45万円,14時間前,ムトーアイテックス株式会社
株式会社ワールドソフト・イーエス,システムエンジニア,帯広市 帯広駅,年収360万円～500万円,14時間前,株式会社ワールドソフト・イーエス
株式会社GSI,プログラマ,北海道,月給26万円～,14時間前,株式会社GSI
